{
  "schema_version": "training-content-v1",
  "pack_id": "TC-VALID-04",
  "title": "Troubleshooting Guide",
  "artifact_type": "troubleshooting_guide",
  "intended_audience": "operator",
  "generated_at": "2026-07-08T22:00:00Z",
  "content": {
    "sections": [
      {
        "id": "common-errors",
        "title": "Common Error Scenarios",
        "body": "Diagnosis and resolution steps for frequently encountered system errors.",
        "sources": [
          "docs/troubleshooting/common-errors.md"
        ]
      }
    ]
  },
  "provenance": {
    "librarian_sources": [
      {
        "path": "docs/troubleshooting/common-errors.md",
        "revision": "jkl012"
      }
    ],
    "generator": "qa-pilot-content-model-test",
    "generator_version": "1.0.0",
    "source_hash": "4aaaaaaaaaaaaaaaaaaaaaaaaaaaaaaaaaaaaaaaaaaaaaaaaaaaaaaaaaaaaaaa"
  },
  "governance": {
    "authority_posture": "advisory",
    "owner_decision_required_for_publish": true,
    "validation_status": "draft",
    "source_coverage_pct": 85,
    "ownership_state": "owned_by_librarian"
  }
}