{
  "schema_version": "training-content-v1",
  "pack_id": "TC-VALID-05",
  "title": "Architecture Explanation",
  "artifact_type": "architecture_explanation",
  "intended_audience": "architect",
  "generated_at": "2026-07-08T22:00:00Z",
  "content": {
    "sections": [
      {
        "id": "system-overview",
        "title": "System Architecture Overview",
        "body": "High-level architectural design including component relationships, data flow, and deployment topology.",
        "sources": [
          "docs/arch/system-overview.md"
        ]
      }
    ]
  },
  "provenance": {
    "librarian_sources": [
      {
        "path": "docs/arch/system-overview.md",
        "revision": "mno345"
      }
    ],
    "generator": "qa-pilot-content-model-test",
    "generator_version": "1.0.0",
    "source_hash": "5aaaaaaaaaaaaaaaaaaaaaaaaaaaaaaaaaaaaaaaaaaaaaaaaaaaaaaaaaaaaaaa"
  },
  "governance": {
    "authority_posture": "advisory",
    "owner_decision_required_for_publish": true,
    "validation_status": "draft",
    "source_coverage_pct": 85,
    "ownership_state": "owned_by_librarian"
  }
}